titulo,genero,duracion,director,protagonistas,estreno,sinopsis,calificacion_usuario,vistas_totales,image_cover
El señor de los anillos: El retorno del rey,Aventura,202,Peter Jackson,"Elijah Wood, Ian McKellen, Viggo Mortensen, Sean Astin, Andy Serkis",2003,"Las fuerzas de Saruman han sido destruidas, y su fortaleza sitiada. Ha llegado el momento de que se decida el destino de la Tierra Media, y por primera vez en mucho tiempo, parece que hay una pequeña esperanza. La atención del señor oscuro Sauron se centra ahora en Gondor, el último reducto de los hombres, y del cual Aragorn tendrá que reclamar el trono para ocupar su puesto de rey. Pero las fuerzas de Sauron ya se preparan para lanzar el último y definitivo ataque contra el reino de Gondor, la batalla que decidirá el destino de todos. Mientras tanto, Frodo y Sam continuan su camino hacia Mordor, a la espera de que Sauron no repare en que dos pequeños Hobbits se acercan cada día más al final de su camino, el Monte del Destino.",0.0,0,
Harry Potter y la piedra filosofal,Aventura,152,Chris Columbus,"Daniel Radcliffe, Rupert Grint, Emma Watson, Richard Harris, Tom Felton",2001,"Harry Potter es un huérfano que vive con sus desagradables tíos, los Dursley, y su repelente primo Dudley. Se acerca su undécimo cumpleaños y tiene pocas esperanzas de recibir algún regalo, ya que nunca nadie se acuerda de él. Sin embargo, pocos días antes de su cumpleaños, una serie de misteriosas cartas dirigidas a él y escritas con una estridente tinta verde rompen la monotonía de su vida: Harry es un mago y sus padres también lo eran.",0.0,0,
Harry Potter y la cámara secreta,Aventura,150,Chris Columbus,"Daniel Radcliffe, Rupert Grint, Emma Watson, Kenneth Branagh, Toby Jones",2002,"Harry regresa a su segundo año a Hogwarts, pero descubre que cosas malas ocurren debido a que un sitio llamado la Cámara de los Secretos ha sido abierto por el heredero de Slytherin y hará que los hijos de muggles, los impuros, aparezcan petrificados misteriosamente por un animal monstruoso.",0.0,0,
Harry Potter y el prisionero de Azkaban,Aventura,141,Alfonso Cuarón,"Daniel Radcliffe, Rupert Grint, Emma Watson, Robbie Coltrane, Michael Gambon",2004,"Harry está deseando que termine el verano para comenzar un nuevo curso en Hogwarts, y abandonar lo antes posible la casa de sus despreciables tíos, los Dursley. Lo que desconoce Harry es que va a tener que abandonar Privet Drive antes de tiempo e inesperadamente después de convertir a su tía Marge en un globo gigante. Un autobús noctámbulo, y encantado por supuesto, le llevará a la taberna El Caldero Chorreante, donde le espera nada menos que Cornelius Fudge, el Ministro de Magia.",0.0,0,
Harry Potter y el cáliz de fuego,Aventura,157,Mike Newell,"Daniel Radcliffe, Rupert Grint, Emma Watson, Brendan Gleeson, Michael Gambon",2005,"En el cuarto año en Hogwarts, Harry se enfrenta al mayor de los desafíos y peligros de la saga. Cuando es elegido bajo misteriosas circunstancias como el competidor que representará a Hogwarts en el Torneo Triwizard, Harry deberá competir contra los mejores jóvenes magos de toda Europa. Pero mientras se prepara, aparecen pruebas que manifiestan que Lord Voldemort ha regresado. Antes de darse cuenta, Harry no solo estará luchando por el campeonato sino también por su vida",0.0,0,
Harry Potter y la Orden del Fénix,Aventura,138,David Yates,"Daniel Radcliffe, Rupert Grint, Emma Watson, Imelda Staunton, Helena Bonham Carter",2007,"Harry Potter regresa por quinto año a Hogwarts aún sacudido por la tragedia ocurrida en el Torneo de los Tres Magos. Debido a que el Ministro de la Magia niega el regreso de Lord Voldemort, Harry se convierte en el centro de atención de la comunidad mágica. Mientras lucha con sus problemas en el colegio, incluyendo a la nueva profesora Dolores Umbridge, intentará aprender más sobre la misteriosa Orden del Fénix.",0.0,0,
Harry Potter y el misterio del príncipe,Aventura,153,David Yates,"Daniel Radcliffe, Rupert Grint, Emma Watson, Jim Broadbent, Michael Gambon",2009,"En medio de los desastres que azotan a Inglaterra, Harry y sus compañeros vuelven a Hogwarts para cursar su sexto año de estudios; y aunque las medidas de seguridad han convertido al colegio en una fortaleza, algunos estudiantes son víctimas de ataques inexplicables. Harry sospecha que Draco Malfoy es el responsable de los mismos y decide averiguar la razón. Mientras tanto, Albus Dumbledore y el protagonista exploran el pasado de Lord Voldemort mediante recuerdos que el director ha recolectado. Con esto, Dumbledore planea preparar al muchacho para el día de la batalla final.",0.0,0,
Harry Potter y las Reliquias de la Muerte - Parte 1,Aventura,146,David Yates,"Daniel Radcliffe, Emma Watson, Rupert Grint, Toby Jones, Helena Bonham Carter",2010,"Una tarea casi imposible cae sobre los hombros de Harry: deberá encontrar y destruir los horrocruxes restantes para dar fin al reinado de Lord Voldemort. En el episodio final de la saga, el hechicero de 17 años parte junto con sus amigos Hermione Granger y Ron Weasley en un peligroso viaje por Inglaterra para encontrar los objetos que contienen los fragmentos del alma del Señor Tenebroso, los cuales garantizan su longevidad. Pero el camino no será fácil pues el lado oscuro adquiere más poder con cada minuto que pasa y las lealtades serán puestas a prueba. Harry deberá usar todos los conocimientos que gracias a Dumbledore ha adquirido sobre su enemigo para poder encontrar la forma de sobrevivir a esta última aventura.",0.0,0,
Harry Potter y las Reliquias de la Muerte - Parte 2,Fantasía,130,David Yates,"Daniel Radcliffe, Emma Watson, Rupert Grint, Ralph Fiennes, Alan Rickman",2011,La segunda parte de la batalla final entre las fuerzas del bien y el mal. El juego nunca ha sido tan peligroso y nadie está a salvo. Se acerca el momento de la confrontación final entre Harry Potter y Lord Voldemort. Todo termina aquí…,0.0,0,
El laberinto del fauno,Fantasía,112,Guillermo del Toro,"Ivana Baquero, Sergi López, Maribel Verdú, Ariadna Gil, Doug Jones",2006,"En la España falangista de 1944, una joven aficionada a los libros e hijastra de un sádico oficial del ejército huye a un misterioso pero cautivador mundo de fantasía.",0.0,0,
Alicia en el País de las Maravillas,Familia,109,Tim Burton,"Mia Wasikowska, Johnny Depp, Anne Hathaway, Helena Bonham Carter, Crispin Glover",2010,"Alicia, una joven de 19 años, asiste a una fiesta en una mansión victoriana, donde descubre que está a punto de recibir una propuesta de matrimonio frente a un montón de gente estirada de la alta sociedad. Alicia entonces se escapa, corriendo tras un conejo blanco, entra a un agujero tras él... y acaba en el país de las Maravillas, un lugar que visitó hace 10 años, pero el cual no recuerda. El país de las Maravillas era un reino pacífico hasta que la Reina Roja derrocó a su hermana, la Reina Blanca. Las criaturas del país de las maravillas, listos para la revuelta, esperan que Alicia les ayude, y éstas a su vez le ayudarán a recordar su primera visita al mágico reino.",0.0,0,
"Las crónicas de Narnia: El león, la bruja y el armario",Aventura,143,Andrew Adamson,"William Moseley, Anna Popplewell, Skandar Keynes, Georgie Henley, Liam Neeson",2005,"La historia narra las aventuras de cuatro hermanos: Lucy, Edmund, Susan y Peter, que durante la Segunda Guerra Mundial descubren el mundo de Narnia, al que acceden a través de un armario mágico mientras juegan al escondite en la casa de campo de un viejo profesor. En Narnia descubrirán un mundo increíble habitado por animales que hablan, duendes, faunos, centauros y gigantes al que la Bruja Blanca- Jadis- ha condenado al invierno eterno. Con la ayuda del león Aslan, el noble soberano, los niños lucharán para vencer el poder que la Bruja Blanca ejerce sobre Narnia en una espectacular batalla y conseguir así liberarle de la maldición del frío.",0.0,0,
Las crónicas de Narnia: El príncipe Caspian,Aventura,144,Andrew Adamson,"William Moseley, Anna Popplewell, Skandar Keynes, Georgie Henley, Ben Barnes",2008,"Un año después de los increíbles acontecimientos de ""El León, la Bruja y el Armario"", los reyes y las reinas de Narnia -los 4 hermanos Pevensie- vuelven a reunirse en ese remoto y fantástico mundo, donde descubrirán que han pasado más de 1.300 años, calculados en tiempo narniano. Durante su ausencia, la Edad de Oro de Narnia ha terminado, y los Telmarinos han conquistado el reino de Narnia, que ahora está dominado por el malvado Rey Miraz. Los cuatro niños no tardarán en conocer un nuevo y extraño personaje: el joven Príncipe Caspian, heredero legítimo al trono que se ha visto obligado a esconderse ya que su tío Miraz trama su asesinato para colocar a su hijo recién nacido en el trono. Los Narnianos, liderados por los poderosos caballeros Peter y Caspian, se embarcan en un extraordinario viaje para encontrar a Aslan, liberar Narnia del yugo tiránico de Miraz y restaurar la magia y la paz en el territorio.",0.0,0,
Stardust,Aventura,127,Matthew Vaughn,"Charlie Cox, Claire Danes, Sienna Miller, Ricky Gervais, Jason Flemyng",2007,"Tristan un joven trabajador y poco adaptado a la sociedad, siempre ha soñado con salir de Muro, pero más ha soñado con Victoria, la muchacha más linda del pueblo, y a quién él corteja incansablemente sin llegar a la fría joven y siendo pasado a llevar por su rival. A pesar de todo, cuando Victoria le comenta que cosas la harían cambiar de opinión de casarse con otro, Tristan no duda en prometerle ir en busca de la primera estrella fugaz que ve pasar, y así lo hace.",0.0,0,
La forma del agua,Drama,119,Guillermo del Toro,"Sally Hawkins, Michael Shannon, Richard Jenkins, Octavia Spencer, Michael Stuhlbarg",2017,"Elisa es una joven muda que trabaja como conserje en un laboratorio en 1963, en plena Guerra Fría, donde se enamorará de un hombre anfibio que se encuentra ahí recluido.",0.0,0,
La milla verde,Fantasía,189,Frank Darabont,"Tom Hanks, David Morse, Bonnie Hunt, Michael Clarke Duncan, James Cromwell",1999,"En el sur de los Estados Unidos, en plena Depresión, Paul Edgecomb es un vigilante penitenciario a cargo de la Milla Verde, un pasillo que separa las celdas de los reclusos condenados a la silla eléctrica. Esperando su ejecución está John Coffey, un gigantesco negro acusado de asesinar brutalmente a dos hermanas de nueve años. Tras una personalidad ingenua, Coffey esconde un don sobrenatural prodigioso. A medida que transcurre la historia, Paul Edgecomb aprende que los milagros ocurren... incluso en los lugares más insospechados.",0.0,0,
Piratas del Caribe: La maldición de la Perla Negra,Aventura,143,Gore Verbinski,"Johnny Depp, Orlando Bloom, Keira Knightley, Geoffrey Rush, Jack Davenport",2003,"El aventurero capitán Jack Sparrow recorre las aguas caribeñas. Pero su andanzas terminan cuando su enemigo, el capitán Barbossa le roba su barco, la Perla Negra, y ataca la ciudad de Port Royal, secuestrando a Elizabeth Swann, hija del gobernador. Will Turner, el amigo de la infancia de Elizabeth, se une a Jack para rescatarla y recuperar la Perla Negra. Pero el prometido de Elizabeth, comodoro Norrington, les persigue a bordo del HMS Impávido. Además, Barbossa y su tripulación son víctimas de un conjuro por el que están condenados a vivir eternamente, y a transformarse cada noche en esqueletos vivientes, en fantasmas guerreros.",0.0,0,
Piratas del Caribe: El cofre del hombre muerto,Aventura,151,Gore Verbinski,"Johnny Depp, Orlando Bloom, Keira Knightley, Stellan Skarsgård, Bill Nighy",2006,"Will Turner y Elizabeth Swann se van a casar, pero ambos son hechos prisioneros por Lord Cutler Beckett y acusados de haber liberado al capitán Jack Sparrow. Para salvar su vida, Will tendrá que encontrar a Jack y conseguir su misteriosa brújula. Esta esconde un gran poder, además de la clave de una deuda de sangre del pirata con un temible y siniestro Davy Jones, el legendario capitán del barco fantasma Holandés Errante.",0.0,0,
