titulo,genero,duracion,director,protagonistas,estreno,sinopsis,calificacion_usuario,vistas_totales,image_cover
La guerra de las galaxias. Episodio II: El ataque de los clones,Aventura,132,George Lucas,"Hayden Christensen, Ewan McGregor, Natalie Portman, Christopher Lee, Samuel L. Jackson",2002,"Corren tenebrosos tiempos para la República. Ésta continúa envuelta en luchas y sumida en el caos. Un movimiento separatista, formado por centenares de planetas y poderosas alianzas y y lideradas por el misterioso conde Dooku, abre nuevas amenazas para la galaxia, a la que ni siquiera los Jedi parecen poder poner freno. Estas maniobras, planeadas hace mucho por una poderosa fuerza, conducen al estallido de las guerras clones y al principio del fin de la República. Para allanar el camino, los separatistas intentan asesinar a la senadora Padme Amidala. Para evitar futuros atentados, su seguridad es encomendada a dos caballeros Jedi...",0.0,0,
La guerra de las galaxias. Episodio III: La venganza de los Sith,Aventura,140,George Lucas,"Hayden Christensen, Ewan McGregor, Natalie Portman, Ian McDiarmid, Samuel L. Jackson",2005,"Último capítulo de la saga de Star Wars, en el que Anakin Skywalker definitivamente se pasa al lado oscuro. En el Episodio III aparecerá el General Grievous, un ser implacable mitad-alien mitad-robot, el líder del ejército separatista Droid. Los Sith son los amos del lado oscuro de la Fuerza y los enemigos de los Jedi. Ellos fueron prácticamente exterminados por los Jedi hace mil años, pero la orden del mal sobrevivió en la clandestinidad.",0.0,0,
La guerra de las galaxias,Aventura,121,George Lucas,"Mark Hamill, Harrison Ford, Carrie Fisher, Peter Cushing, Alec Guinness",1977,"La princesa Leia, líder del movimiento rebelde que desea reinstaurar la República en la galaxia en los tiempos ominosos del Imperio, es capturada por las malévolas Fuerzas Imperiales, capitaneadas por el implacable Darth Vader, el sirviente más fiel del emperador. El intrépido Luke Skywalker, ayudado por Han Solo, capitán de la nave espacial ""El Halcón Milenario"", y los androides, R2D2 y C3PO, serán los encargados de luchar contra el enemigo y rescatar a la princesa para volver a instaurar la justicia en el seno de la Galaxia.",0.0,0,
El imperio contraataca,Aventura,124,Irvin Kershner,"Mark Hamill, Harrison Ford, Carrie Fisher, Billy Dee Williams, Anthony Daniels",1980,"Tras un ataque sorpresa de las tropas imperiales a las bases camufladas de la alianza rebelde, Luke Skywalker, en compañía de R2D2, parte hacia el planeta Dagobah en busca de Yoda, el último maestro Jedi, para que le enseñe los secretos de la Fuerza. Mientras, Han Solo, la princesa Leia, Chewbacca, y C3PO esquivan a las fuerzas imperiales y piden refugio al antiguo propietario del Halcón Milenario, Lando Calrissian, en la ciudad minera de Bespin, donde les prepara una trampa urdida por Darth Vader.",0.0,0,
El retorno del Jedi,Aventura,133,Richard Marquand,"Mark Hamill, Harrison Ford, Carrie Fisher, Billy Dee Williams, Anthony Daniels",1983,"Luke Skywalker y la princesa Leia deben viajar a Tatooine para liberar a Han Solo. Para conseguirlo, deben infiltrarse en la peligrosa guarida de Jabba the Hutt, el gángster más temido de la galaxia. Una vez reunidos, el equipo recluta a tribus de Ewoks para combatir a las fuerzas imperiales en los bosques de la luna de Endor. Mientras tanto, el Emperador y Darth Vader conspiran para convertir a Luke al lado oscuro, pero el joven Skywalker, por su parte, está decidido a reavivar el espíritu del Jedi en su padre. La guerra civil galáctica culmina en un último enfrentamiento entre las fuerzas rebeldes unificadas y una segunda Estrella de la Muerte, indefensa e incompleta, en una batalla que decidirá el destino de la galaxia.",0.0,0,
Star Wars: El despertar de la fuerza,Aventura,136,J.J. Abrams,"Harrison Ford, Mark Hamill, Carrie Fisher, Adam Driver, Daisy Ridley",2015,"Treinta años después de la victoria de la Alianza Rebelde sobre la segunda Estrella de la Muerte (hechos narrados en el Episodio VI: El retorno del Jedi), la galaxia está todavía en guerra. Una nueva República se ha constituido, pero una siniestra organización, la Primera Orden, ha resurgido de las cenizas del Imperio Galáctico. A los héroes de antaño, que luchan ahora en la Resistencia, se suman nuevos héroes: Poe Dameron, un piloto de caza, Finn, un desertor de la Primera Orden, Rey, una joven chatarrera, y BB-8, un androide rodante. Todos ellos luchan contra las fuerzas del Mal: el Capitán Phasma, de la Primera Orden, y Kylo Ren, un temible y misterioso personaje que empuña un sable de luz roja.",0.0,0,
Star Wars: Los últimos Jedi,Aventura,150,Rian Johnson,"Mark Hamill, Carrie Fisher, Adam Driver, Daisy Ridley, John Boyega",2017,"La malvada Primera Orden se ha vuelto más poderosa y tiene contra las cuerdas a la Resistencia, liderada por la General Leia Organa. El piloto Poe Dameron encabeza una misión para intentar destruir un acorazado de la Primera Orden. Mientras tanto, la joven Rey tendrá que definir su futuro y su vocación, y el viejo jedi Luke Skywalker revaluar el significado de su vida.",0.0,0,
Star Wars: El ascenso de Skywalker,Aventura,141,J.J. Abrams,"Carrie Fisher, Mark Hamill, Daisy Ridley, Adam Driver, John Boyega",2019,"Un año después de los eventos de ""Los últimos Jedi"", los restos de la Resistencia se enfrentarán una vez más a la Primera Orden, involucrando conflictos del pasado y del presente. Mientras tanto, el antiguo conflicto entre los Jedi y los Sith llegará a su clímax, lo que llevará a la saga de los Skywalker a un final definitivo. Final de la trilogía iniciada con ""El despertar de la Fuerza"".",0.0,0,
Iron Man,Acción,126,Jon Favreau,"Robert Downey Jr., Terrence Howard, Jeff Bridges, Gwyneth Paltrow, Leslie Bibb",2008,"El multimillonario fabricante de armas Tony Stark debe enfrentarse a su turbio pasado después de sufrir un accidente con una de sus armas. Equipado con una armadura de última generación tecnológica, se convierte en 'El hombre de hierro' para combatir el mal a escala global.",0.0,0,
El increíble Hulk,Ciencia ficción,114,Louis Leterrier,"Edward Norton, Liv Tyler, Tim Roth, William Hurt, Tim Blake Nelson",2008,"El científico Bruce Banner recorre el mundo tratando de encontrar una cura a su problema, en busca de un antídoto que le permita librarse de su Alter Ego. Perseguido por el ejército y por su propia rabia interna, es incapaz de sacar de su cabeza a Betty Ross. Así que se decide a volver a la civilización, donde debe enfrentarse a una criatura creada cuando el agente de la KGB, Emil Blonsky, se expone a una dosis superior de la radiación que convirtió a Bruce en Hulk. Incapaz de volver a su estado humano, Emil hace responsable a Hulk de su aterradora condición, mientras que la ciudad de Nueva York se convierte en el escenario de la última batalla entre las dos criaturas más poderosas que jamás han pisado la Tierra.",0.0,0,
Iron Man 2,Aventura,125,Jon Favreau,"Robert Downey Jr., Gwyneth Paltrow, Don Cheadle, Scarlett Johansson, Sam Rockwell",2010,"El mundo sabe que el multimillonario Tony Stark es Iron Man, el superhéroe enmascarado. Sometido a presiones por parte del gobierno, la prensa y la opinión pública para que comparta su tecnología con el ejército, Tony es reacio a desvelar los secretos de la armadura de Iron Man porque teme que esa información pueda caer en manos indeseables.",0.0,0,
Thor,Aventura,115,Kenneth Branagh,"Chris Hemsworth, Natalie Portman, Tom Hiddleston, Anthony Hopkins, Stellan Skarsgård",2011,"Thor es un arrogante y codicioso guerrero cuya imprudencia desata una antigua guerra. Por ese motivo, su padre Odín lo castiga desterrándolo a la Tierra para que viva entre los hombres y descubra así el verdadero sentido de la humildad. Cuando el villano más peligroso de su mundo envía a la Tierra a las fuerzas más oscuras de Asgard, Thor se dará cuenta de lo que realmente hace falta para ser un verdadero héroe.",0.0,0,
Capitán América: El primer vengador,Acción,124,Joe Johnston,"Chris Evans, Hayley Atwell, Sebastian Stan, Tommy Lee Jones, Hugo Weaving",2011,"Nacido durante la Gran Depresión, Steve Rogers creció como un chico enclenque en una familia pobre. Horrorizado por las noticias que llegaban de Europa sobre los nazis, decidió enrolarse en el ejército; sin embargo, debido a su precaria salud, fue rechazado una y otra vez. Enternecido por sus súplicas, el general Chester Phillips le ofrece la oportunidad de tomar parte en un experimento especial: la Operación Renacimiento. Tras meses de preparación y entrenamiento recibe su primera misión como Capitán América. Armado con un escudo indestructible y su inteligencia para la batalla, el Capitán América emprende la guerra contra el mal, como centinela de la libertad y como líder de los Vengadores.",0.0,0,
Los Vengadores,Ciencia ficción,143,Joss Whedon,"Robert Downey Jr., Chris Evans, Mark Ruffalo, Chris Hemsworth, Scarlett Johansson",2012,"Cuando un enemigo inesperado surge como una gran amenaza para la seguridad mundial, Nick Fury, director de la Agencia SHIELD, decide reclutar a un equipo para salvar al mundo de un desastre casi seguro.",0.0,0,
Iron Man 3,Acción,130,Shane Black,"Robert Downey Jr., Gwyneth Paltrow, Don Cheadle, Guy Pearce, Rebecca Hall",2013,"El descarado y brillante empresario Tony Stark/Iron Man se enfrentará a un enemigo cuyo poder no conoce límites. Cuando Stark comprende que su enemigo ha destruido su universo personal, se embarca en una angustiosa búsqueda para encontrar a los responsables. Este viaje pondrá a prueba su entereza una y otra vez. Acorralado, Stark tendrá que sobrevivir por sus propios medios, confiando en su ingenio y su instinto para proteger a las personas que quiere.",0.0,0,
Thor: el mundo oscuro,Acción,112,Alan Taylor,"Chris Hemsworth, Natalie Portman, Tom Hiddleston, Christopher Eccleston, Anthony Hopkins",2013,"Thor lucha por restablecer el orden en el cosmos, pero una antigua raza liderada por el vengativo Malekith regresa con el propósito de volver a sumir el universo en la oscuridad. Se trata de un villano con el que ni siquiera Odín y Asgard se atreven a enfrentarse; por esa razón, Thor tendrá que emprender un viaje muy peligroso, durante el cual se reunirá con Jane Foster y la obligará a sacrificarlo todo para salvar el mundo.",0.0,0,
Capitán América: El soldado de invierno,Acción,136,Joe Russo,"Chris Evans, Samuel L. Jackson, Scarlett Johansson, Robert Redford, Sebastian Stan",2014,"Capitán América, Viuda Negra y un nuevo aliado, Falcon, se enfrentan a un enemigo inesperado mientras intentan sacar a la luz una conspiración que pone en riesgo al mundo.",0.0,0,
Guardianes de la Galaxia: Volumen 3,Ciencia ficción,150,James Gunn,"Chris Pratt, Zoë Saldaña, Dave Bautista, Karen Gillan, Pom Klementieff",2023,"La querida banda de los Guardianes se instala en Knowhere. Pero sus vidas no tardan en verse alteradas por los ecos del turbulento pasado de Rocket. Peter Quill, aún conmocionado por la pérdida de Gamora, debe reunir a su equipo en una peligrosa misión para salvar la vida de Rocket, una misión que, si no se completa con éxito, podría muy posiblemente conducir al final de los Guardianes tal y como los conocemos.",0.0,0,
Vengadores: La Era de Ultrón,Acción,140,Joss Whedon,"Robert Downey Jr., Chris Hemsworth, Mark Ruffalo, Chris Evans, Scarlett Johansson",2015,"Cuando Tony Stark intenta reactivar un programa caído en desuso cuyo objetivo es mantener la paz, las cosas empiezan a torcerse y los héroes más poderosos de la Tierra, incluyendo a Iron Man, Capitán América, Thor, El Increíble Hulk, Viuda Negra y Ojo de Halcón, tendrán que afrontar la prueba definitiva cuando el destino del planeta se ponga en juego. Cuando el villano Ultron emerge, le corresponderá a Los Vengadores detener sus terribles planes, que junto a incómodas alianzas llevarán a una inesperada acción que allanará el camino para una épica y única aventura.",0.0,0,
Ant-Man,Ciencia ficción,117,Peyton Reed,"Paul Rudd, Michael Douglas, Evangeline Lilly, Corey Stoll, Bobby Cannavale",2015,"Armado con la asombrosa capacidad de reducir su tamaño a la dimensiones de un insecto, el estafador Scott Lang debe sacar a relucir al héroe que lleva dentro y ayudar a su mentor, el doctor Hank Pym, a proteger de una nueva generación de amenazas el secreto que se esconde tras el traje de Ant-Man, con un casco que le permite comunicarse con las hormigas. A pesar de los obstáculos aparentemente insuperables que les acechan, Pym y Lang deben planear y llevar a cabo un atraco para intentar salvar al mundo.",0.0,0,
Capitán América: Civil War,Aventura,147,Joe Russo,"Chris Evans, Robert Downey Jr., Scarlett Johansson, Sebastian Stan, Anthony Mackie",2016,"Continúa la historia de “Avengers: Age of Ultron”, con Steve Rogers liderando un nuevo equipo de Vengadores en su esfuerzo por proteger a la humanidad. Tras otro incidente internacional relacionado con los Vengadores que ocasiona daños colaterales, la presión política fuerza a crear un sistema de registro y un cuerpo gubernamental para determinar cuándo se requiere los servicios del equipo. El nuevo status quo divide a los Vengadores mientras intentan salvar al mundo de un nuevo y perverso villano.",0.0,0,
Doctor Strange en el multiverso de la locura,Fantasía,126,Sam Raimi,"Benedict Cumberbatch, Xochitl Gomez, Elizabeth Olsen, Chiwetel Ejiofor, Benedict Wong",2022,"Viaja a lo desconocido con el Doctor Strange, quien, con la ayuda de tanto antiguos como nuevos aliados místicos, recorre las complejas y peligrosas realidades alternativas del multiverso para enfrentarse a un nuevo y misterioso adversario.",0.0,0,
Guardianes de la galaxia Vol. 2,Ciencia ficción,137,James Gunn,"Chris Pratt, Zoë Saldaña, Dave Bautista, Vin Diesel, Bradley Cooper",2017,"Continúan las aventuras del equipo en su travesía por los confines del cosmos. Los Guardianes deberán luchar para mantener unida a su nueva familia mientras intentan resolver el misterio de los verdaderos orígenes de Peter Quill. Viejos rivales se convertirán en nuevos aliados, y queridos personajes de los cómics clásicos acudirán en ayuda de nuestros héroes a medida que el universo cinematográfico de Marvel continúa expandiéndose.",0.0,0,
Spider-Man: Homecoming,Acción,129,Jon Watts,"Tom Holland, Michael Keaton, Robert Downey Jr., Marisa Tomei, Jon Favreau",2017,"Peter Parker comienza a experimentar su recién descubierta identidad como el superhéroe Spider-Man. Después de la experiencia vivida con los Vengadores, Peter regresa a casa, donde vive con su tía. Bajo la atenta mirada de su mentor Tony Stark, Peter intenta mantener una vida normal como cualquier joven de su edad, pero interrumpe en su rutina diaria el nuevo villano Vulture y, con él, lo más importante de la vida de Peter comenzará a verse amenazado.",0.0,0,
Thor: Ragnarok,Acción,131,Taika Waititi,"Chris Hemsworth, Mark Ruffalo, Tom Hiddleston, Cate Blanchett, Idris Elba",2017,"Thor está preso al otro lado del universo sin su poderoso martillo y se enfrenta a una carrera contra el tiempo. Su objetivo es volver a Asgard y parar el Ragnarok porque significaría la destrucción de su planeta natal y el fin de la civilización Asgardiana a manos de una todopoderosa y nueva amenaza, la implacable Hela. Pero, primero deberá sobrevivir a una competición letal de gladiadores que lo enfrentará a su aliado y compañero en los Vengadores, ¡el Increíble Hulk!",0.0,0,
Black Panther,Acción,134,Ryan Coogler,"Chadwick Boseman, Michael B. Jordan, Lupita Nyong'o, Danai Gurira, Martin Freeman",2018,"Después de los acontecimientos de ""Capitán América: Civil War"", T'Challa vuelve a casa, la nación aislada y muy avanzada tecnológicamente de Wakanda, para ser proclamado Rey. Pero la reaparición de un viejo enemigo pone a prueba el temple de T'Challa como Rey y Black Panther ya que se ve arrastrado a un conflicto que pone en peligro todo el destino de Wakanda y del mundo.",0.0,0,
Vengadores: Infinity War,Aventura,156,Joe Russo,"Robert Downey Jr., Chris Evans, Chris Hemsworth, Josh Brolin, Mark Ruffalo",2018,"El todopoderoso Thanos ha despertado con la promesa de arrasar con todo a su paso, portando el Guantelete del Infinito, que le confiere un poder incalculable. Los únicos capaces de pararle los pies son los Vengadores y el resto de superhéroes de la galaxia, que deberán estar dispuestos a sacrificarlo todo por un bien mayor. Capitán América e Ironman deberán limar sus diferencias, Black Panther apoyará con sus tropas desde Wakanda, Thor y los Guardianes de la Galaxia e incluso Spider-Man se unirán antes de que los planes de devastación y ruina pongan fin al universo. ¿Serán capaces de frenar el avance del titán del caos?",0.0,0,
Ant-Man y la Avispa: Quantumanía,Acción,125,Peyton Reed,"Paul Rudd, Evangeline Lilly, Michael Douglas, Michelle Pfeiffer, Jonathan Majors",2023,"La pareja de superhéroes Scott Lang y Hope van Dyne regresa para continuar sus aventuras como Ant-Man y la Avispa. Los dos, junto a los padres de Hope, Hank Pym y Janet van Dyne y la hija de Scott, Cassie Lang, se dedican a explorar el Mundo Cuántico, interactuando con nuevas y extrañas criaturas y embarcándose en una aventura que les llevará más allá de los límites de lo que creían posible.",0.0,0,
Capitana Marvel,Acción,125,Ryan Fleck,"Brie Larson, Samuel L. Jackson, Ben Mendelsohn, Jude Law, Annette Bening",2019,"La historia sigue a Carol Danvers mientras se convierte en uno de los héroes más poderosos del universo, cuando la Tierra se encuentra atrapada en medio de una guerra galáctica entre dos razas alienígenas. Situada en los años 90, 'Capitana Marvel' es una historia nueva de un período de tiempo nunca antes visto en la historia del Universo Cinematográfico de Marvel.",0.0,0,
Vengadores: Endgame,Aventura,181,Anthony Russo,"Robert Downey Jr., Chris Evans, Mark Ruffalo, Chris Hemsworth, Scarlett Johansson",2019,"Después de los eventos devastadores de 'Vengadores: Infinity War', el universo está en ruinas debido a las acciones de Thanos. Con la ayuda de los aliados que quedaron, los Vengadores deberán reunirse una vez más para intentar deshacer sus acciones y restaurar el orden en el universo de una vez por todas, sin importar cuáles sean las consecuencias... Cuarta y última entrega de la saga ""Vengadores"".",0.0,0,
Spider-Man: Lejos de casa,Acción,135,Jon Watts,"Tom Holland, Jake Gyllenhaal, Samuel L. Jackson, Marisa Tomei, Jon Favreau",2019,"Peter Parker decide irse junto a Michelle Jones, Ned y el resto de sus amigos a pasar unas vacaciones a Europa después de los eventos ocurridos en Vengadores: EndGame. Sin embargo, el plan de Parker por dejar de lado sus superpoderes durante unas semanas se ven truncados cuándo es reclutado por Nick Fury para unirse a Mysterio (un humano que proviene de la Tierra 833, una dimensión del multiverso, que tuvo su primera aparición en Doctor Strange) para luchar contra los elementales (cuatro entes inmortales que vienen de la misma dimensión y que dominan los cuatro elementos de la naturaleza, el fuego, el agua, el aire y la tierra) . En ese momento, Parker vuelve a ponerse el traje de Spider-Man para cumplir con  su labor.",0.0,0,
Star Trek: La película,Ciencia ficción,131,Robert Wise,"William Shatner, Leonard Nimoy, DeForest Kelley, James Doohan, George Takei",1979,"Siglo XXIII. Al Almirante James T. Kirk, de la nave Enterprise, se le encomienda una difícil misión: neutralizar un extraño cuerpo para que no colisione con la Tierra. El Oficial Spock, el Capitán Willard Decker, la Asesora Ilía y el Doctor McCoy ayudan al Almirante Kirk a descubrir la naturaleza de este cuerpo sideral, provisto de un mecanismo de inteligencia de origen terrestre. La expedición del Enterprise localiza al ente y entonces se apresta a introducirse en su centro de operaciones...",0.0,0,
Star Trek II: La ira de Khan,Acción,112,Nicholas Meyer,"William Shatner, Leonard Nimoy, Ricardo Montalban, DeForest Kelley, James Doohan",1982,El Enterprise transporta a un grupo de científicos que se disponen a poner a prueba el mayor experimento jamás imaginado por el hombre: la formación de vida en un planeta inerte.,0.0,0,
Star Trek III: En busca de Spock,Ciencia ficción,101,Leonard Nimoy,"William Shatner, DeForest Kelley, James Doohan, George Takei, Walter Koenig",1984,"Tras la desaparición de Spock y la creación del planeta Génesis, la tripulación del Enterprise se dispone a localizar el cuerpo de su compañero, a petición del padre de éste.",0.0,0,
Star Trek IV: Misión salvar la Tierra,Ciencia ficción,114,Leonard Nimoy,"William Shatner, Leonard Nimoy, DeForest Kelley, James Doohan, George Takei",1986,"En el siglo XXIII, un misterioso poder alienígena amenaza la Tierra, evaporando los océanos y destruyendo la atmósfera. En un frenético intento para salvar a la humanidad, el Capitán Kirk y su tripulación viajan en el tiempo y regresan al San Francisco de 1986, encontrándose con un mundo de punks, pizza y autobuses de cambio exacto, que les resultan tan alienígenas como todo lo que han encontrado en los lugares más recónditos de la galaxia.",0.0,0,
Star Trek V: La última frontera,Ciencia ficción,102,William Shatner,"William Shatner, Leonard Nimoy, DeForest Kelley, James Doohan, George Takei",1989,"La nave Enterprise se dirige al planeta Nimbus III, para negociar la liberación de unos embajadores secuestrados. Allí descubrirán que el jefe de la banda es un pariente de Spock, obsesionado por encontrar el planeta que es considerado la fuente de la vida.",0.0,0,
Star Trek VI: Aquel país desconocido,Ciencia ficción,109,Nicholas Meyer,"William Shatner, Leonard Nimoy, DeForest Kelley, James Doohan, George Takei",1991,"Tras años de guerra, la Federación y el Imperio Klingon se disponen a celebrar una conferencia de paz. Pero el panorama de una negociación intergaláctica, con implacables enemigos, preocupa al Almirante Kirk. Cuando una nave Klingon es atacada y responsabilizan al Enterprise, ambos mundos se preparan para el que puede ser su encuentro definitivo.",0.0,0,
Star Trek VII: La próxima generación,Ciencia ficción,113,David Carson,"Patrick Stewart, Jonathan Frakes, Brent Spiner, LeVar Burton, Michael Dorn",1994,"James T. Kirk, Montgomery Scott y Pavel Chekov asisten al viaje inaugural del USS Enterprise-B, que es requerido para ayudar a un convoy de naves que se hallan atrapadas en un cinturón de energía. Debido a la inexperiencia del capitán, Kirk decide ayudar pero cuando la cubierta donde se hallaba es destruida por una ráfaga de energía, es dado por muerto.",0.0,0,
Star Trek VIII: Primer contacto,Ciencia ficción,106,Jonathan Frakes,"Patrick Stewart, Jonathan Frakes, Brent Spiner, LeVar Burton, Michael Dorn",1996,"El Capitán del Enterprise encuentra de nuevo a sus adversarios, los Borg, a quienes intenta impedir modificar la historia y conquistar la Tierra en el siglo XXI, por medio de un viaje en el tiempo, que impediría el primer vuelo warp de la raza humana y el consiguiente primer contacto con una raza extraterrestre: los vulcanos.",0.0,0,
Star Trek IX: Insurrección,Ciencia ficción,99,Jonathan Frakes,"Patrick Stewart, Jonathan Frakes, Brent Spiner, LeVar Burton, Michael Dorn",1998,"Jean-Luc Picard, capitán del USS Enterprise, recibe un mensaje de la flota. Al parecer, el comandante Data, que se encontraba estudiando una sociedad primitiva, ha sufrido un cortocircuito y ha revelado la existencia del equipo de investigación a los habitantes del planeta Ba'Ku. Pronto descubrirá que intentaba defender a ésta sociedad inocente de las aspiraciones de los Son'a.",0.0,0,
Star Trek X: Némesis,Ciencia ficción,112,Stuart Baird,"Patrick Stewart, Jonathan Frakes, Brent Spiner, LeVar Burton, Michael Dorn",2002,"La policía romulana obtiene ADN del Capitán Picard y fabrican un clon, llamado Shinzon, con la finalidad de introducirlo en la Federación, pero ese plan queda en nada y envían al clon a las minas de dilitio de Remo, el planeta hermano de Rómulo, la capital del Imperio Romulano. Shinzon organiza un golpe de estado gracias a las fuerzas Remanas y su imbatible nave erigiéndose nuevo Pretor Romulano.",0.0,0,
Star Trek,Ciencia ficción,127,J.J. Abrams,"Chris Pine, Zachary Quinto, Leonard Nimoy, Eric Bana, Bruce Greenwood",2009,"Todo está preparado para el viaje inaugural de la nave más moderna que jamás se haya creado: la USS Enterprise. Su joven tripulación tiene una importante misión: encontrar una manera de detener al malvado Nero que, movido por la venganza, amenaza a toda la humanidad. Pero el destino de la galaxia está en manos de dos jóvenes rivales, que nacieron en mundos diferentes. Uno de ellos, Tiberius James Kirk, humano, busca emociones y es un líder nato. El otro, Spock, medio humano y medio vulcaniano, es menospreciado por los vulcanianos, por sus emociones humanas.",0.0,0,
